{
  "$schema": "https://json-schema.org/draft/2020-12/schema",
  "title": "AltmanAI Master Ledger Entry",
  "type": "object",
  "properties": {
    "registry_id": {
      "type": "string"
    },
    "title": {
      "type": "string"
    },
    "category": {
      "type": "string"
    },
    "timestamp": {
      "type": "string",
      "format": "date-time"
    },
    "participants": {
      "type": "array",
      "items": {
        "type": "string"
      }
    },
    "summary": {
      "type": "string"
    },
    "artifact_links": {
      "type": "array",
      "items": {
        "type": "string"
      }
    },
    "sha256": {
      "type": "string"
    },
    "custody_line": {
      "type": "string"
    },
    "poc_tags": {
      "type": "array",
      "items": {
        "type": "object"
      }
    }
  },
  "required": [
    "registry_id",
    "title",
    "category",
    "timestamp",
    "summary"
  ]
}
